Pontificia Universidad Católica del Perú. Escuela de Posgrado,Modelamiento del tiempo a la ocurrencia de un evento con tiempos discretos,"Huertas Quispe, Anthony Enrique",Magíster en Estadística,"Bayes Rodríguez, Cristian Luis","En este trabajo de tesis, se plantea estudiar el tiempo a la ocurrencia de un evento en un proceso discreto. Para ello, se considera un modelo mixtura de fracción de cura sobre una población segmentada en dos tipos de individuos: sujetos curados, o también denominados sobrevivientes a largo plazo, haciendo referencia a aquellos sujetos que no alcanzarán el evento de interés en estudio; y sujetos no curados, o también denominados sujetos susceptibles, quienes en un tiempo específico, experimentarán dicho evento de interés. Los objetivos principales de esta tesis, son el de estimar la fracción de cura, la cual está definida como la proporción de individuos curados al final del estudio, y estimar el tiempo de falla para los individuos susceptibles, entendiéndose como el tiempo a la ocurrencia del evento. Este análisis se llevará a cabo con la presencia de covariables y datos censurados, siendo la simulación e inferencia de los datos efectuados vía el software estadístico R, en donde los procesos de simulación abordarán distintos escenarios para evaluar la performance del modelo propuesto.",2021-01-18
Pontificia Universidad Católica del Perú. Escuela de Posgrado,Métodos de selección de variables bajo el enfoque bayesiano para el modelo lineal normal,"Blas Oyola, Sthip Frank",Magíster en Estadística,"Bayes Rodríguez, Cristian Luis","En muchos casos prácticos, al realizar un análisis de regresión, se cuenta con un gran
número de potenciales variables explicativas de las cuáles sólo algunas serán importantes para explicar la variable respuesta. Por lo tanto, un problema importante para la construcción de un modelo de regresión es encontrar un adecuado conjunto de variables explicativas. A los métodos que lidian con este problema se les denomina métodos de selección de variables. En el presente proyecto de tesis, se estudiarán tres métodos de selección de variables bajo inferencia bayesiana para el modelo de regresión lineal normal los cuales fueron propuestos por George y McCulloch (1993), Kuo y Mallick (1998) y Dellaportas et al. (2002). Estos métodos, a diferencia de los métodos tradicionales, consideran la selección de variables dentro del mismo modelo, por ejemplo, introduciendo variables latentes que indiquen la presencia o ausencia de una variable explicativa. Se realizaron comparaciones de estos métodos bayesianos con los métodos Lasso y Stepwise por ser los más tradicionales. A través de un estudio con datos simulados, en diversos escenarios se observa que los métodos bayesianos permiten una adecuada selección de las variables explicativas. Adicionalmente se presentan los resultados de una aplicación con datos reales.",2021-01-18
Pontificia Universidad Católica del Perú. Escuela de Posgrado,Sistema de tarifación bonus-malus para la rama de seguros de automóvil,"Vivanco Ortiz, Yoshi Abel",Magíster en Estadística,"Valdivieso Serrano, Luis Hilmar","En la actualidad, las empresas aseguradoras cuentan con productos de seguros
cada vez más personalizados a las características de sus asegurados, de modo que,
cada asegurado no pague el mismo monto de prima sino un monto proporcional a su
comportamiento y perfil de riesgo. Una de las formas de atender esta necesidad de
personalización en la tarifación es el Sistema Bonus-Malus (SBM), el cual ajusta una
prima base considerando la historia de siniestros reportados por cada asegurado. En
ese sentido, una historia sin siniestros crea bonificaciones (bonus) y por ende una
reducción en la prima de seguro; y, una historia con siniestros genera penalizaciones
(malus) y por ende un incremento en la prima de seguro. Por tanto, el objetivo de
esta tesis es aplicar los modelos SBM basados en la frecuencia para un seguro de
tipo vehicular. Para ello, en base a la información disponible de los asegurados, se
construye un modelo de frecuencia de siniestros usando un GLM (Poisson, Binomial
Negativa y sus variantes inflacionadas en ceros), cada modelo permite obtener
una prima base y clases de riesgo basados en características heterogéneas. Luego,
se comparan todos los modelos obtenidos para seleccionar el mejor ajuste para los
datos analizados. Por u´ltimo, se aplica el SBM y se determina en qué nivel se clasifica
a cada asegurado en función al número de siniestros que reporte en el periodo
de análisis, de esa manera, se determina el valor de la prima ajustada para cada
asegurado. En resumen, este trabajo desarrolla un SBM con información a priori y a
posteriori que permite obtener primas más justas para los asegurados de un producto
de seguros vehiculares, de modo que, el asegurado que presente un comportamiento
sin siniestros reportados pagará menos que un asegurado que presente siniestros en
el periodo evaluado.",2021-01-18
Pontificia Universidad Católica del Perú. Escuela de Posgrado,Modelo de supervivencia de larga duración con riesgos proporcionales y estimación del riesgo base vía splines: modelamiento de abandono de seguros,"Mattos Galarza, Hector",Magíster en Estadística,"Sal y Rosas Celi, Víctor Giancarlo","Survival models, those that are focused on trying to describe the time before the ocurrence of one
or more events, have demonstrated great versatility in their capacity to model various types of events
and a further reach than initially proposed. Its application encompasses from medical trials to uses in
financial activities like assets risk management, among others. This work focuses in the analysis of
the time of a customer until their decision of termination of an insurance policy. In this application,
only a fraction of the population are prone to terminate their contract and, in this sense, it is needed
that the model have a certain degree of flexibility of assuming that not all the clients are susceptible
to this event. A long-term proportional hazard model is proposed in this work with base risk function
modeled via monotone splines. This work starts with the model definition, the parameters estimation
process, simulation scenarios where the estimation and inference process performance is evaluated and
finally an application to study the associated factors with the churn process for an insurance company
in Perú.",2021-01-12
Pontificia Universidad Católica del Perú. Escuela de Posgrado,Jointly modelling of cluster dependent pro les of fractional and binary variables from a Bayesian point of view,"Cortés Tejada, Fernando Javier",Magíster en Estadística,"Bayes Rodríguez, Cristian Luis","The following thesis proposes classi cation models that consist of jointly  tting longitudinal
pro les of mixed fractional and binary variables modelled by zero-one beta in
ated mixed
regressions with cluster formation. The distinct proposed parametrizations allow di erent effects
to be modelled, such as modelling the marginal mean directly through independent
variables and easily interpret its e ect on it or modelling the conditional mean and the in-

ation probabilities separately. In addition, individuals with similar fractional longitudinal
pro les are grouped into a cluster through a latent variable, assuming that the response variables
follow a  nite mixture model. Due to the complexity of the models, the parameters are
estimated from a Bayesian point of view by simulating a MCMC using JAGS software in R.
The proposed models are  tted in various simulated datasets and are compared against other
models to measure performance in  tting fractional longitudinal pro les and binary variables.
Finally, an application on real data is conducted, consisting on longitudinal information of
credit card utilization ratio and default status as dependants variables and covariates corresponding
to client information, aiming to obtain clusters of clients with similar behaviour in
evolution of credit card utilization and relate them to their probability of default.",2020-10-27
Pontificia Universidad Católica del Perú. Escuela de Posgrado,"Regresión espacial cuantílica para variables acotadas entre (0,1)","García Céspedes, Carlos Jeffer",Magíster en Estadística,"Quiroz Cornejo, Zaida Jesús","El Perú es un país emergente donde el desarrollo se centra en algunas ciudades y distritos específicos. Esto conlleva a mucha desigualdad económica por ello resulta importante dar seguimiento a la incidencia de pobreza en el país. De acuerdo al nivel de precariedad, la pobreza puede considerarse extrema o no extrema. En este contexto, estudiamos la incidencia de pobreza no extrema a través de un modelo de regresión cuantílica espacial a nivel distrital en la provincia de Lima utilizando la distribución de Kumaraswamy combinada con un efecto espacial intrínseco condicional autorregresivo (ICAR). Para tratar y evaluar la posible confusión espacial entre los efectos espaciales y las covariables de efectos fijos, se considera, también, el enfoque SPOCK (Spatial Orthogonal Centroid \K""orrection). Nuestros modelos pertenecen a la clase de modelos jerárquicos, para los cuales la inferencia se puede realizar utilizando el método de Monte Carlo Hamiltoniano. Por lo tanto, el modelo es computacionalmente factible para grandes conjuntos de datos, puede describir puntos extremos de la distribución de la incidencia de pobreza no extrema e identificar qué factores son importantes en las colas de la distribución de los datos.",2020-10-26
Pontificia Universidad Católica del Perú. Escuela de Posgrado,Extensión al modelo DINA reparametrizado con covariable,"Sáenz Egúsquiza, Miguel Angel",Magíster en Estadística,"Valdivieso Serrano, Luis Hilmar","En el campo educacional, cuando los estudiantes resuelven problemas su habilidad en un tema particular puede influir en el desempeño de los mismos en un área de estudio similar pero diferente. Por ejemplo, la habilidad en ciencias podría tener un efecto en su dominio sobre las matemáticas, lo que a su vez afectará la forma en que los evaluados responden a las preguntas o ítems sobre matemáticas de una prueba. Por tanto, resulta natural examinar la relación entre el rendimiento en un área particular de estudio y el dominio de los atributos en un tema relacionado. Los modelos de diagnóstico cognitivo (CDM) proporcionan un marco ideal para realizar un análisis de este tipo, ya que clasifican a los examinados en perfiles de atributos que indican su dominio en las habilidades delimitadas permitiendo obtener información más específica con respecto a sus fortalezas y debilidades. Los CDM resuelven varias limitaciones de los métodos clásicos y los modelos de teoría de respuesta a ítems unidimensionales (TRI).
Para este estudio se amplía el marco de DINA al incorporar una covariable en un modelo de DINA reparametrizado. La covariable se puede especificar en dos niveles: en el nivel inferior, afectando la forma en que los evaluados resuelven los ítems (es decir, la probabilidad de respuesta), y en el nivel superior, influenciando en el dominio de los atributos (es decir, la clasificación latente). En esta tesis, se desarrolla teóricamente el modelo indicado desde el enfoque clásico. Para la estimación desarrollaremos el método de máxima verosimilitud y el método de la moda a posteriori vía el algoritmo de Esperanza-Maximización (EM) y de Newton-Raphson. Para tal fin, se realiza 4 estudios de simulación con la finalidad de observar en primer lugar el efecto de la covariable cuando afecta simultáneamente a los ítems y a los atributos, luego cuando la covariable afecta por separado a ambos, y también cuando la covariable no los afecta. Finalmente, se muestra su aplicación en la evaluación de la prueba de admisión a una Universidad.",2020-10-20
Pontificia Universidad Católica del Perú. Escuela de Posgrado,Modelo bayesiano geoestadístico beta-inflacionado utilizando NNGP con aplicación a datos de cobertura forestal,"Barriga Pozada, Alfonso Carlos Cesar",Magíster en Estadística,"Quiroz Cornejo, Zaida Jesús","In this thesis, we propose a new geostatistical beta inflated zero-one model using
NNGP (Nearest Neighbor Gaussian Process). The main advantage of using NNGP in
the modeling of spatial effects is the reduction of the large computing time it takes to
model a Gaussian process since it does not need to work with all the neighbors, but
only with a small group. The estimation of the parameters is done from a bayesian
perspective since the posterior distribution does not have a known shape. In addition,
a simulation studywas carried out inwhich testswere donewith different amounts of
neighborstoevaluateintermsofRMSEandcomputational timethegaininthemodels
whenaddingmore neighbors.Finally, the proportionof forest cover inHiroshimawas
modeled using the developed geostatistical model, obtaining good results.",2020-09-29
Pontificia Universidad Católica del Perú. Escuela de Posgrado,Modelo lineal mixto de clases latentes con respuesta ordinal y su aplicación en la medición de la religiosidad,"Renteria Sacha, Ivonne Mireille",Magíster en Estadística,"Valdivieso Serrano, Luis Hilmar","Latent class linear mixed models developed by Proust-Lima, Philipps y Liquet (2017) are useful to analyze the dynamic aspect and the multidimensional nature of a phenomenon of interest in populations not necessarily homogeneous. These allow to identify the possible latent classes in the population under study and how a set of covariates affects the response variable of interest in each class. In this thesis, the latent class linear mixed model with latent response variable and ordinal manifest variable is developed, through its two components: the structural sub-model and the measure sub-model, which are complemented with a mul-tinominal logistic model to analyze the probability of belonging to a latent class. The model was applied to a dataset from the National Study of Youth and Religion (NSYR), in order to find latent classes in the religiosity construct and to describe their evolution. As a result, three latent classes were identified with different trajectories for each case.",2020-01-16
Pontificia Universidad Católica del Perú. Escuela de Posgrado,El Modelo de Respuesta Nominal: Aplicación a datos educacionales,"Rivera Espejo, José Manuel",Magíster en Estadística,"Tarazona Vargas, Enver Gerald","This thesis focuses its e orts on presenting and studying the Nominal Response Model
or NRM (Bock, 1972, 1997), in the context of the Item Response Theory (IRT). Simulation
studies are carried out to determine the quality of the recovery of the parameters of the
model, under the Classic (MML) and Bayesian (MCMC) aproach and  nally, the studied
model was applied to an random, representative and anonymous sample of 1641 teachers
from the Basic Regular Education modality of the english specialty, who were exposed to the
Reading-Comprehension sub-test of the \Concurso de Nombramiento 2015"".
Related to the simulation, we found the bayesian method is a good substitute for the
classic counterpart, because it recovers in a similarly satisfactory fashion the parameters of
the items; however, the main disadvantage was that the process was between 620 to 14; 100
times slower than the classical approach, despite the special emphasis on making the MCMC
processes parrallel.
Related to the results of the implementation of the model on real data, the NRM: (i) it
facilitates the recovery of a greater proportion of information available in the items, compared
to dichotomous response models (Bock, 1972; Thissen, 1976; Levine y Drasgow, 1983;
Thissen y Steinberg, 1984), (ii) it allows to  nd the implicit order in initially not ordered
categorical data (Samejima, 1988; Bock, 1997) and (iii) it provided relevant information for
the examination of the quality of an item (Thissen et al., 1989), specially in two fronts: (a) it
allowed the identi cation of useless or forced alternatives and (b) it allowed the identi cation
of alternatives that could be collapsed, given that these alternatives registered a similar topics.</td><td></td>
</tr>
<tr class=""ds-table-row even "">
<td class=""label-cell"">dc.description.abstract</td><td class=""word-break"">La presente tesis centra sus esfuerzos en presentar y estudiar el Modelo de Respuesta
Nominal o NRM por sus siglas en inglés (Bock, 1972, 1997), en el contexto de la Teoría de Respuesta al ítem (IRT, por sus siglas en inglés). Se realizaron estudios de simulación para determinar la calidad de la recuperación de los parámetros del modelo, bajo la metodología clásica (MML) y bayesiana (MCMC) y finalmente, se aplicó el modelo estudiado en una muestra anónima, aleatoria y representativa de 1641 docentes de la modalidad de Educación Básica Regular de la especialidad de inglés, que fueron expuestos a la sub-prueba de Compresión Lectora del Concurso de Nombramiento 2015.
En relación a la simulación, encontramos que el método bayesiano es un buen sustituto de su contraparte clásica, debido a que el mismo recupera de manera similarmente satisfactoria los parámetros de los ítems; sin embargo, la principal desventaja es que fue entre 620 a 14100 veces más lento que los métodos clásicos, pese a que se puso especial énfasis en hacer paralelos los procesos MCMC.
En relación a los resultados de la aplicación se tiene que el NRM: (i) facilita la recuperación de una mayor proporción información disponible en los ítems, frente a los modelos de respuestas dicotómicas (Bock, 1972; Thissen, 1976; Levine y Drasgow, 1983; Thissen y Steinberg, 1984), (ii) permite hallar el ordenamiento implícito en datos categóricos inicialmente no ordenados (Samejima, 1988; Bock, 1997) y (iii) brinda información relevante para la valoración de la calidad de un ítem (Thissen et al., 1989), especialmente en dos puntos: (a) les permitía identificar alternativas inservibles o forzadas y (b) les permita identificar alternativas que se podían colapsar, dado que estas alternativas registraban similar temática.",2019-07-17
Pontificia Universidad Católica del Perú. Escuela de Posgrado,El modelo de larga duración Weibull-Geométrica,"Torres Salinas, Karina Hesi",Magíster en Estadística,"Sal y Rosas Celi, Víctor Giancarlo","Los modelos de larga duración son una extensión de los modelos de supervivencia tradicional
y nos permiten modelar una proporción de la población que no llegan a experimentar
un evento de interés, incluso después de un largo periodo de seguimiento. En este trabajo
se presenta y deduce la distribución de larga duración Weibull-Geométrica y su proceso de estimación e inferencia. Se desarrolló un estudio de simulación con el un de evaluar el desempeño de las estimaciones y determinar si se recuperan los parámetros. Asimismo el modelo fue aplicado a una muestra de clientes que adquirieron y activaron una tarjeta de crédito
entre enero a diciembre del año 2015 y donde el principal objetivo del análisis era entender el
comportamiento del tiempo hasta la cancelación de la tarjeta de crédito del cliente. Comparamos
al modelo de larga duración Weibull-Geométrica con otros modelos de larga duración,
Exponencial-Geométrica y Weibull. Los resultados indican que nuestro modelo muestra un
mejor ajuste en los datos.",2019-03-20
Pontificia Universidad Católica del Perú. Escuela de Posgrado,Modelo G-DINA aplicado al diagnóstico de desórdenes mentales,"Villena Guzmán, Denisse",Magíster en Estadística,"Tarazona Vargas, Enver Gerald","Actualmente, uno de los modelos de diagnóstico cognitivo (MDC) más usados es el modelo
DINA. Sin embargo, este modelo presenta varias restricciones que hacen que en muchas
ocasiones, no sea el que mejor se ajusta a la realidad. En ese contexto, nace una generalización
del modelo DINA, denominado G-DINA (Generalized deterministic input, noisy and gate).
En el presente estudio se presentan los fundamentos y propiedades del modelo G-DINA y
su aplicación en un área en el que su uso todavía no es muy común: la psicología. Así, se
evaluaron los resultados de una muestra de pacientes de un hospital general de Lima a los
que se les aplicó el test SRQ-18 que evalúa la presencia de desórdenes mentales. Se muestra
el proceso de selección del mejor modelo para cada ítem, los resultados de los parámetros
obtenidos, los diagnósticos para los 10 primeros pacientes y una distribución de los perfiles
de estos pacientes. Finalmente se presenta un estudio de simulación que tiene por finalidad
estudiar el efecto del tamaño de muestra en la estimación de los parámetros en el contexto
de la aplicación de este estudio.",2019-02-11
Pontificia Universidad Católica del Perú. Escuela de Posgrado,Análisis bayesiano de modelos de clases latentes para variables politómicas: Confianza hacia instituciones públicas,"Cruz Sarmiento, Marylía Paola",Magíster en Estadística,"Valdivieso Serrano, Luis Hilmar","El modelo de análisis de clases latentes tiene como  finalidad describir una variable no observable a través del agrupamiento de los individuos en base a sus patrones de respuestas.
La estimación en este modelo se puede realizar mediante el algoritmo de Esperanza-Maximización (EM) y su desarrollo para el caso politómico se encuentra implementado en el paquete poLCA de R. Desde el punto de vista bayesiano, esta estimación ha sido hasta el momento implementada sólo para el caso de variables dicotómicas. En este trabajo, se busca
extender este  ultimo aporte para el caso politómico, haciendo uso del muestrador de Gibbs.
La aplicación del modelo de análisis de clases latentes, bajo el enfoque bayesiano aquí desarrollado, se realizó sobre un conjunto de datos reales relacionados con la con fianza hacia 21 instituciones públicas en una encuesta para Lima Metropolitana. En general, se identificaron tres grupos de encuestados seg un sus niveles de confianza institucional, los cuales se analizaron luego en relación a otras variables.",2019-02-11
Pontificia Universidad Católica del Perú. Escuela de Posgrado,Modelo secuencial con aplicación a la medición del rendimiento estudiantil,"Mejía Campos, Luis Ángel",Magíster en Estadística,"Tarazona Vargas, Enver Gerald","En este trabajo se presenta el Modelo Secuencial para datos politómicos ordinales de la
teoría de respuesta al ítem y sus características. De forma específi ca se estudia el Modelo
Secuencial Logístico de 2 parámetros (2PL-SM). La estimación de este modelo se realiza
utilizando Métodos de Cadenas de Markov de Montecarlo (MCMC), los cuales fueron implementados
en R y WinBUGS.
Se realizó un estudio de simulación con el objetivo de estudiar la precisión en la recuperación de parámetros observándose resultados apropiados según los índices de precisión
utilizados.
El Modelo Secuencial en estudio fue luego aplicado a la prueba de escritura de la Evaluación Muestral 2013 del Ministerio de Educación, evaluación que fue aplicada a una muestra
de 4327 estudiantes de sexto grado de primaria de todo el país. Con la aplicación del modelo a
la prueba se pudo determinar que en general esta contiene ítems cuyas di ficultades son bajas
y que, para los estudiantes, el enfrentarse a esta prueba no debería resultarles complicado.",2019-02-04
Pontificia Universidad Católica del Perú. Escuela de Posgrado,El modelo de larga duración Exponencial-Poisson,"Gonzales Rodriguez, Julia Elena",Magíster en Estadística,"Sal y Rosas Celi, Víctor Giancarlo","In this thesis the long-term survival model Exponential-Poisson will be introduced and
discussed. This model allows to study the time until the occurrence of an event of interest
when it is assumed that there is a fraction of the population that is immune to the occurrence
of this event. The studied model is a mixture model that assumes that the time to the event
among susceptible follows a Exponential-Poisson distribution and that the probability of
being inmune to the event of interes is explained by a set of covariates via a logistic regression
model. A simulation study was carried out in which the good performance of the model was
checked through the percentage bias and 95% coverage. Finally, the model is applied to a
sample of a Peruvian  nantial entity where the event of interest is the cancellation of the
debt.",2018-12-03
Pontificia Universidad Católica del Perú. Escuela de Posgrado,Modelo de regresión a la media simplex inflacionada para proporciones,"Chámpac Flores, Juan Carlos",Magíster en Estadística,"Bayes Rodríguez, Cristian Luis","El presente trabajo de tesis propone el modelo de regresión a la media simplex inflacionada,
que permite modelar variables aleatorias continuas limitadas en el intervalo cerrado [0; 1]
al considerar un conjunto de ecuaciones de regresión para estimar la media de la respuesta
y los parámetros que modelan las probabilidades de los valores extremos 0 y 1. Asimismo,
se desarrolla un estudio de simulación con el  fin de evaluar si el método propuesto permite
recuperar los parámetros del modelo desde el punto de vista de la estadística clásica. Por
otro lado, se desarrolla la aplicación del modelo para determinar el grado de dolarización
de empresas que registran deudas en el Sistema Financiero, y para evaluar el desempeño del
mismo, se compara contra el modelo de regresión a la media beta inflacionada. Los resultados
muestran un mejor ajuste del modelo propuesto en esta tesis.",2018-11-15
